{
  "schema_version":1,
  "metadata":{
    "name":"landing_zone",
    "description":"Lunar surface ops board: lander pad, charging stations, construction/paint module-placement stops, mining zones, and inspection points. Mixed open-terrain spline + painted-line follow for the long charging traverses.",
    "coordinate_system":{
      "heading_offset_deg":0,
      "frame":"local_enu",
      "origin":{
        "alt_m":-120,
        "lat":-89.9,
        "lon":0
      },
      "units":"mm"
    },
    "bounds":{
      "x_max":2400,
      "y_min":-200,
      "y_max":2200,
      "x_min":-200
    },
    "author":"system_node_control/construction/scripts/build_landing_zone.lua",
    "created_at":"2026-05-06T19:15:57Z"
  },
  "ui":{
    "node_styles":{
      "transit":{
        "color":"#aaa",
        "icon":"dot",
        "size":"small"
      },
      "base":{
        "color":"#888",
        "icon":"rocket",
        "label":"Base"
      },
      "pass_gate":{
        "color":"#888",
        "icon":"doorway",
        "label":"Gate"
      },
      "inspection_scan":{
        "color":"#c60",
        "icon":"magnifier",
        "label":"Inspection"
      },
      "load_shipping":{
        "color":"#06c",
        "icon":"crate",
        "label":"Shipping"
      },
      "recharge":{
        "color":"#0a0",
        "icon":"battery",
        "label":"Charging"
      },
      "paint_sample":{
        "color":"#c0c",
        "icon":"paintbrush",
        "label":"Paint"
      },
      "deliver_part":{
        "color":"#06c",
        "icon":"package",
        "label":"Delivery"
      }
    },
    "edge_styles":{
      "path_spline":{
        "color":"#69f",
        "width":2,
        "stroke":"solid"
      },
      "path_line":{
        "color":"#666",
        "width":2,
        "stroke":"dotted"
      },
      "path_wall":{
        "color":"#a00",
        "width":2,
        "stroke":"dashed"
      }
    }
  },
  "nodes":[{
      "name":"lander_pad",
      "x":0,
      "y":0,
      "type":"base",
      "description":"Lander touchdown pad and mission start."
    },{
      "name":"habitat_site",
      "x":800,
      "y":0,
      "type":"pass_gate",
      "params":{
        "gate_id":"hab_north",
        "drive_through":600
      },
      "description":"Habitat air-lock pass-through gate."
    },{
      "name":"junction_central",
      "x":800,
      "y":400,
      "type":"transit"
    },{
      "name":"junction_north",
      "x":1200,
      "y":0,
      "type":"transit"
    },{
      "name":"charging_station_a",
      "x":800,
      "y":800,
      "type":"recharge",
      "params":{
        "hold_time":30000,
        "contact_target":"ground_pad"
      },
      "description":"Primary charging pad next to the central junction."
    },{
      "name":"charging_station_b",
      "x":1600,
      "y":1200,
      "type":"recharge",
      "params":{
        "hold_time":30000,
        "contact_target":"ground_pad"
      },
      "description":"Secondary charging pad on the eastern transit ring; used when central pad is occupied or out of range."
    },{
      "name":"survey_point_1",
      "x":0,
      "y":800,
      "type":"inspection_scan",
      "params":{
        "sensor_type":1,
        "sensor_port":0
      },
      "description":"Surface composition sample point west of the lander."
    },{
      "name":"inspection_scan",
      "x":1700,
      "y":0,
      "type":"inspection_scan",
      "params":{
        "sensor_type":2,
        "sensor_port":0
      },
      "description":"Mining-area inspection station."
    },{
      "name":"transit_build_n",
      "x":800,
      "y":1400,
      "type":"transit"
    },{
      "name":"transit_build_w",
      "x":600,
      "y":1600,
      "type":"transit"
    },{
      "name":"construction_bay",
      "x":800,
      "y":1600,
      "type":"load_shipping",
      "params":{
        "arm_speed":90,
        "arm_target":30,
        "payload_type":2
      },
      "description":"Module-placement bay; arm extends to 30°, payload type 2."
    },{
      "name":"paint_station",
      "x":1000,
      "y":1800,
      "type":"paint_sample",
      "params":{
        "arm_speed":60,
        "hold_time":500,
        "arm_target":15
      },
      "description":"Paint-sample station; arm holds at 15° for 500 ms."
    },{
      "name":"mining_zone_a",
      "x":1550,
      "y":-80,
      "type":"deliver_part",
      "params":{
        "arm_speed":80,
        "arm_target":-45,
        "payload_type":1
      },
      "description":"Mining sample drop-off A; arm sweeps to -45°."
    },{
      "name":"transit_mine_w",
      "x":1500,
      "y":0,
      "type":"transit"
    },{
      "name":"mining_zone_b",
      "x":1600,
      "y":2000,
      "type":"deliver_part",
      "params":{
        "arm_speed":80,
        "arm_target":-45,
        "payload_type":1
      },
      "description":"Final delivery target; long traverse from the lander."
    }],
  "edges":[{
      "description":"Lander → habitat via open spline.",
      "from":"lander_pad",
      "to":"habitat_site",
      "nav":"path_spline",
      "speed":150,
      "weight":800,
      "path":[0,0,267,0,533,0,800,0]
    },{
      "from":"lander_pad",
      "to":"survey_point_1",
      "nav":"path_spline",
      "speed":120,
      "weight":800,
      "path":[0,0,0,267,0,533,0,800]
    },{
      "from":"habitat_site",
      "to":"junction_north",
      "nav":"path_spline",
      "speed":150,
      "weight":400,
      "path":[800,0,933,0,1067,0,1200,0]
    },{
      "from":"habitat_site",
      "to":"junction_central",
      "nav":"path_spline",
      "speed":140,
      "weight":400,
      "path":[800,0,800,133,800,267,800,400]
    },{
      "from":"junction_central",
      "to":"charging_station_a",
      "nav":"path_spline",
      "speed":130,
      "weight":400,
      "path":[800,400,800,533,800,667,800,800]
    },{
      "from":"charging_station_a",
      "to":"transit_build_n",
      "nav":"path_spline",
      "speed":130,
      "weight":600,
      "path":[800,800,800,1000,800,1200,800,1400]
    },{
      "description":"Cross-traverse over rough terrain; weight intentionally higher than Euclidean distance to discourage routing.",
      "from":"survey_point_1",
      "to":"charging_station_a",
      "nav":"path_spline",
      "speed":100,
      "weight":1131,
      "path":[0,800,267,800,533,800,800,800]
    },{
      "description":"Painted lane along the western mast; line-follow vehicle speed limited by paint visibility.",
      "from":"survey_point_1",
      "to":"transit_build_w",
      "nav":"path_line",
      "speed":90,
      "weight":1200,
      "path":[0,800,200,1067,400,1333,600,1600]
    },{
      "from":"transit_build_n",
      "to":"transit_build_w",
      "nav":"path_spline",
      "speed":120,
      "weight":280,
      "path":[800,1400,733,1467,667,1533,600,1600]
    },{
      "description":"Curved approach from north; sweeps slightly west to clear the gantry leg before final straight-in.",
      "from":"transit_build_n",
      "to":"construction_bay",
      "nav":"path_spline",
      "speed":80,
      "weight":220,
      "path":[800,1400,780,1450,760,1520,780,1570,800,1600]
    },{
      "description":"Curved approach from west.",
      "from":"transit_build_w",
      "to":"construction_bay",
      "nav":"path_spline",
      "speed":80,
      "weight":220,
      "path":[600,1600,650,1580,700,1560,750,1580,800,1600]
    },{
      "description":"Curved approach to paint station from north transit.",
      "from":"transit_build_n",
      "to":"paint_station",
      "nav":"path_spline",
      "speed":80,
      "weight":280,
      "path":[800,1400,850,1520,950,1700,1000,1780,1000,1800]
    },{
      "from":"junction_north",
      "to":"transit_mine_w",
      "nav":"path_spline",
      "speed":150,
      "weight":300,
      "path":[1200,0,1300,0,1400,0,1500,0]
    },{
      "from":"transit_mine_w",
      "to":"mining_zone_a",
      "nav":"path_spline",
      "speed":100,
      "weight":100,
      "path":[1500,0,1517,-27,1533,-53,1550,-80]
    },{
      "description":"Spur from mining transit to the inspection station.",
      "from":"transit_mine_w",
      "to":"inspection_scan",
      "nav":"path_spline",
      "speed":100,
      "weight":220,
      "path":[1500,0,1567,0,1633,0,1700,0]
    },{
      "description":"Direct long traverse via central junction.",
      "from":"junction_central",
      "to":"mining_zone_b",
      "nav":"path_spline",
      "speed":130,
      "weight":894,
      "path":[800,400,1067,933,1333,1467,1600,2000]
    },{
      "description":"Painted-lane shuttle between primary and secondary charging pads. Used when one pad is unavailable.",
      "from":"charging_station_a",
      "to":"charging_station_b",
      "nav":"path_line",
      "speed":90,
      "weight":1500,
      "path":[800,800,1067,933,1333,1067,1600,1200]
    },{
      "from":"charging_station_b",
      "to":"mining_zone_b",
      "nav":"path_spline",
      "speed":130,
      "weight":700,
      "path":[1600,1200,1600,1467,1600,1733,1600,2000]
    }],
  "markers":[],
  "ui":{
    "node_styles":{
      "transit":{
        "color":"#aaa",
        "icon":"dot",
        "size":"small"
      },
      "base":{
        "color":"#888",
        "icon":"rocket",
        "label":"Base"
      },
      "pass_gate":{
        "color":"#888",
        "icon":"doorway",
        "label":"Gate"
      },
      "inspection_scan":{
        "color":"#c60",
        "icon":"magnifier",
        "label":"Inspection"
      },
      "load_shipping":{
        "color":"#06c",
        "icon":"crate",
        "label":"Shipping"
      },
      "recharge":{
        "color":"#0a0",
        "icon":"battery",
        "label":"Charging"
      },
      "paint_sample":{
        "color":"#c0c",
        "icon":"paintbrush",
        "label":"Paint"
      },
      "deliver_part":{
        "color":"#06c",
        "icon":"package",
        "label":"Delivery"
      }
    },
    "edge_styles":{